{
  "$schema": "https://json-schema.org/draft/2020-12/schema",
  "title": "HEP Numerics Figure Provenance",
  "type": "object",
  "additionalProperties": false,
  "required": [
    "analysis_id",
    "generated_at",
    "scan_csv_sha256",
    "scan_meta_sha256",
    "scan_execution_sha256",
    "render_config_snapshot",
    "renderer",
    "outputs",
    "input_provenance"
  ],
  "properties": {
    "analysis_id": {
      "type": "string",
      "pattern": "^analysis-[0-9]{3}$"
    },
    "generated_at": {
      "type": "string",
      "pattern": "^\\d{4}-\\d{2}-\\d{2}T\\d{2}:\\d{2}:\\d{2}(?:\\.\\d+)?(?:Z|\\+00:00)$"
    },
    "scan_csv_sha256": {
      "$ref": "#/$defs/checksum"
    },
    "scan_meta_sha256": {
      "$ref": "#/$defs/checksum"
    },
    "scan_execution_sha256": {
      "$ref": "#/$defs/checksum"
    },
    "render_config_snapshot": {
      "type": "object",
      "additionalProperties": false,
      "required": [
        "analysis_id",
        "model_name",
        "figures"
      ],
      "properties": {
        "analysis_id": {
          "type": "string",
          "pattern": "^analysis-[0-9]{3}$"
        },
        "model_name": {
          "type": "string"
        },
        "figures": {
          "type": "array"
        }
      }
    },
    "renderer": {
      "type": "object",
      "additionalProperties": false,
      "required": [
        "name",
        "contract_version"
      ],
      "properties": {
        "name": {
          "const": "hep-numerics/make_figures.py"
        },
        "contract_version": {
          "const": 1
        }
      }
    },
    "outputs": {
      "type": "array",
      "minItems": 1,
      "uniqueItems": true,
      "items": {
        "type": "object",
        "additionalProperties": false,
        "required": [
          "path",
          "sha256"
        ],
        "properties": {
          "path": {
            "type": "string",
            "pattern": "^numerics/figures/analysis-[0-9]{3}/[A-Za-z0-9_.-]+\\.(?:pdf|png)$"
          },
          "sha256": {
            "$ref": "#/$defs/checksum"
          }
        }
      }
    },
    "input_provenance": {
      "$ref": "#/$defs/dependency_graph"
    }
  },
  "$defs": {
    "checksum": {
      "type": "string",
      "pattern": "^sha256:[0-9a-f]{64}$"
    },
    "dependency_graph": {
      "type": "object",
      "additionalProperties": false,
      "required": [
        "version",
        "verification_status",
        "entries",
        "root_sha256"
      ],
      "properties": {
        "version": {
          "const": "sha256-bytes-v1"
        },
        "verification_status": {
          "const": "verified"
        },
        "entries": {
          "type": "array",
          "minItems": 1,
          "uniqueItems": true,
          "items": {
            "type": "object",
            "additionalProperties": false,
            "required": [
              "scope",
              "role",
              "path",
              "sha256"
            ],
            "properties": {
              "scope": {
                "enum": [
                  "project",
                  "repository"
                ]
              },
              "role": {
                "type": "string",
                "pattern": "^[^\\s]+$"
              },
              "path": {
                "type": "string",
                "pattern": "^[^/\\\\]+(?:/[^/\\\\]+)*$"
              },
              "sha256": {
                "$ref": "#/$defs/checksum"
              }
            }
          }
        },
        "root_sha256": {
          "$ref": "#/$defs/checksum"
        }
      }
    }
  }
}
